{
  "spec_version": "0.3",
  "endpoint": "https://vector.invalid/checker-wallet-empty",
  "checked_at": "2026-09-28T00:00:00Z",
  "network": "eip155:8453",
  "check_type": "full",
  "outcome": "checker_error",
  "overall_passed": false,
  "highest_stage_passed": 4,
  "x402_version": 2,
  "input_source": "none",
  "stages": [
    {
      "stage": 1,
      "name": "availability",
      "passed": true
    },
    {
      "stage": 2,
      "name": "402_response",
      "passed": true
    },
    {
      "stage": 3,
      "name": "payment_terms",
      "passed": true
    },
    {
      "stage": 4,
      "name": "price_validity",
      "passed": true
    },
    {
      "stage": 5,
      "name": "payment_processing",
      "passed": false,
      "error_code": "INSUFFICIENT_BALANCE",
      "fault": "checker"
    },
    {
      "stage": 6,
      "name": "delivery",
      "passed": null
    },
    {
      "stage": 7,
      "name": "schema_validity",
      "passed": null
    }
  ]
}
